{
    "$schema": "http://json-schema.org/draft-07/schema#",
    "title": "Cover Letter Data",
    "type": "object",
    "properties": {
        "name": {
            "type": "string",
            "description": "Full name of the applicant"
        },
        "contact": {
            "type": "object",
            "properties": {
                "city": {
                    "type": "string",
                    "description": "City of residence"
                },
                "state": {
                    "type": "string",
                    "description": "State of residence (abbreviated)"
                },
                "phone": {
                    "type": "string",
                    "description": "Phone number in format +1-XXX-XXX-XXXX"
                },
                "email": {
                    "type": "string",
                    "format": "email",
                    "description": "Email address"
                }
            },
            "required": ["city", "state", "phone", "email"],
            "additionalProperties": false
        },
        "company": {
            "type": "string",
            "description": "Name of the target company"
        },
        "position": {
            "type": "string",
            "description": "Title of the position being applied for"
        },
        "salutation": {
            "type": "string",
            "description": "Opening greeting, e.g. 'Dear Hiring Manager,'"
        },
        "closing": {
            "type": "string",
            "description": "Closing valediction, e.g. 'Sincerely,'"
        },
        "date": {
            "type": "string",
            "description": "Date the letter was sent; defaults to the render date when omitted"
        },
        "paragraphs": {
            "type": "array",
            "items": {
                "type": "string"
            },
            "minItems": 1,
            "description": "Main paragraphs of the cover letter"
        },
        "alternate_paragraphs": {
            "type": "array",
            "items": {
                "type": "string"
            },
            "description": "Alternative paragraphs that can be used in place of main paragraphs"
        }
    },
    "required": ["name", "contact", "salutation", "closing", "paragraphs"],
    "additionalProperties": false
}